type;key1;key2;descrLong;description;descrShort
<flow>;/session/.*/.*/_beginSession;;Begin;Begin sessions;Number/flow of session beginnings
<percent>;/session/.*/.*/_activeSession;/session/.*/.*/_beginSession;Active;Active sessions;Number/percentage of active sessions
<counter>;/session/.*/.*/_endSession;;End;End sessions;Number of session ends
<value>;/session/.*/.*/_sessionTime;/session/.*/.*/_endSession;Duration;Session duration;Time duration of the session between the beginning and the end in seconds
<counter>;/session/.*/.*/.*/_messageNumber;;Msg;Message number;Number of messages belonging to a session
<value>;/session/.*/.*/.*/_messageTime;/session/.*/.*/.*/_messageNumber;Time;Message timestamp;Time between the beginning of the session and the message arrival